title,url,thumbnail,channel,description
WELCOME BACK TO MY BEAUTIFUL WORLD | MINECRAFT GAMEPLAY #92,https://www.youtube.com/watch?v=CB73SkC5iwQ,https://i.ytimg.com/vi/CB73SkC5iwQ/hqdefault.jpg?sqp=-oaymwEcCPYBEIoBSFXyq4qpAw4IARUAAIhCGAFwAcABBg==&rs=AOn4CLApMSwRp-Q9Lnzf2EcALXfZrzc1Ig,Techno Gamerz,"WELCOME BACK TO MY BEAUTIFUL WORLD | MINECRAFT GAMEPLAY #92 #minecraft #ujjwal #technogamerz Subscribe to our Second YouTube Channel: https://www.youtube.com/c/UjjwalGamer Share, Support,..."
TRAVEL INSURANCE! ft. Pantar Log convos! @KirtiChow @RIYAGOGOI @Swasti1,https://www.youtube.com/watch?v=U_CEHOf3Wv8,https://i.ytimg.com/vi/U_CEHOf3Wv8/hqdefault.jpg?sqp=-oaymwEcCPYBEIoBSFXyq4qpAw4IARUAAIhCGAFwAcABBg==&rs=AOn4CLCEqVhFHrS8qRgPKZ-JXYSp55Hvtg,R.G Bucket List,Join my Discord for a fun upcoming event : https://discord.gg/rgbucketlist ---------------------------------------------------------------------------------- These are the things that I use...
"Biparjoy का Rajasthan में असर Barmer में बारिश ने 25 साल का रिकॉर्ड तोड़ा, कई इलाकों में बाढ़",https://www.youtube.com/watch?v=sBOSu7sN9nA,,Amar Ujala,#biparjoy #rajasthanweather #heavyrain #amarujalanews चक्रवाती तूफान बिपरजॉय अब राजस्थान में कहर मचा रहा...
"Seetimaarr | New Released Hindi Dubbed Movie | Tottempudi Gopichand, Tamannaah Bhatia, Digangana",https://www.youtube.com/watch?v=WXP_fh0vSOM,,Pen Movies,"Seetimaarr | New Released Hindi Dubbed Movie | Tottempudi Gopichand, Tamannaah Bhatia, Digangana #Seetimaarr #HindiDubbedMovie #TottempudiGopichand #TamannaahBhatia Enjoy Super Hit 4K Movies..."
"Heart Of Stone | Official Hindi Trailer | Gal Gadot, Alia Bhatt, Jamie Dornan | Netflix India",https://www.youtube.com/watch?v=VLjCc0BU95E,,Netflix India,"Mehmaanawazi ke liye taiyaar hain aap? Dekhiye Gal Gadot aur Alia Bhatt ko, iss dhuaandaar action film, Heart of Stone mein, jald, sirf Netflix par! #TUDUM Playlists ————— Official..."
17 - WTF moments in Adipurush,https://www.youtube.com/watch?v=eXMyAvA0654,,BnfTV,Adipurush movie has some bizarre moments from Prabhas look to Saif ali khan's raavan. 17 wtf moments in Adipurush. badal yadav bnftv #adipurush #bnftv Join this channel to get access to...
Adipurush movie is Super Cringe! (MY REVIEW),https://www.youtube.com/watch?v=RFnZXg0kKPI,,Thugesh Unfiltered,#funnymemes #adipurush #raavan Join broadcast channel now! https://ig.me/j/AbbxBKWzXOfsc55l/ In this video we review adipurush movie and funny indian memes and bollywood videos! ▶️...
ONE PIECE | Official Teaser Trailer | Netflix,https://www.youtube.com/watch?v=lNMSqxQtO0w,,Netflix,"Here’s a first look at the live action adaptation of the most popular manga in history, written by Eiichiro Oda. ONE PIECE sets sail on August 31st only on Netflix. SUBSCRIBE: http://bit.ly/29qB..."
Khawaja Hits Unbeaten Century | Highlights - England v Australia Day 2 | LV= Insurance Test 2023,https://www.youtube.com/watch?v=I5EcnXH0Ntc,,England & Wales Cricket Board,Go to ecb.co.uk to join We Are England Cricket Supporters for free and get priority access to tickets and much more! Watch match highlights from the Day 2 of the LV= Insurance Test between...
Test in Balance On Rainy Day | Highlights - England v Australia Day 3 | LV= Insurance Test 2023,https://www.youtube.com/watch?v=tWpsIaHf0Ns,,England & Wales Cricket Board,Go to ecb.co.uk to join We Are England Cricket Supporters for free and get priority access to tickets and much more! Watch match highlights from the Day 3 of the LV= Insurance Test between...
